<?xml version="1.0" encoding="utf-8"?>


<root xmlns:xs ="http://www.w3.org/2001/XMLSchema-instance"
        xs:noNamespaceSchemaLocation = "country_test.xsd">

    <country c_code = "de">
        <name>Germany</name>
        <capital>Berlin</capital>
        <description>Germany is awsome</description>
        <visa_cost currency="usd">777</visa_cost>
    </country>

    <country c_code = "fra">
        <name>France</name>
        <capital>Paris</capital>
        <description>I love wine!</description>
        <visa_cost currency="usd">777</visa_cost>
    </country>

    <country c_code = "gb">
        <name>Great Britain</name>
        <capital>London</capital>
        <description>London is a capital of GB</description>
        <visa_cost currency="usd">777</visa_cost>
    </country>

    <country c_code = "hng">
        <name>Britain</name>
        <capital>ondon</capital>
        <description>ondon is a capital of GB</description>
        <visa_cost currency="usd">777</visa_cost>
    </country>

</root>